Sheet: survey invitations 
A1: Name | B1: Tag | C1: Recipients | D1: Returns | E1: Comments | F1: eMail Template
A2: OPENNEXT Consortium + Demonstrators | B2: OSH SME | C2: of:=23+12 -> 35 | D2: 1 | E2: pilots & demonstrators | F2: workshop-invitation-template.md
B3: OSH research | C3: 38 | D3: 1
B4: fablab/makerspace | C4: 21 | D4: 0
B5: other consortium partner | C5: 24 | D5: 0
A6: Open Source Ecology Germany | B6: OSH community (OSH without relevant commercial use) | C6: of:=106+280+10+10 -> 406 | D6: 1 | E6: incl. FabCity Hamburg, Appropedia, Open-KnowHow | F6: survey-invitation-template.md
A7: D3.1 interviewees | B7: OSH SME | C7: 11 | D7: 0
B8: fablab/makerspace | C8: 2 | D8: 0
B9: OSH community (OSH without relevant commercial use) | C9: 6 | D9: 0

Sheet: survey results (all) per person
A1: Question | B1: Result 1 | C1: Result 2 | D1: Result 3
A3: First, please tell us the role you are representing in this survey | B3: Researcher | C3: Hardware developer | D3: Researcher
A4: specified "other" role:
A5: Before we start, have you ever published an open source hardware project yourself (or closely experienced someone doing so)? | B5: Yes | C5: Yes | D5: Ney
A6: What did you type into the search field? | B6: pinhole camera | C6: whistle | D6: pcr
A7: Please upload your file(s) | B7: LOSHExploreData-1655724946057.csv | C7: LOSHExploreData-1653666301689.csv | D7: LOSHExploreData-1653659814685.csv
A8: First impression: How relevant are the results for you? | B8: 3 | C8: 4 | D8: 3
A9: Please rate the usefulness of the search functionality | B9: 3 | C9: 3 | D9: 3
A10: Any search features you have been missing? (e.g. additional filters) | B10: not easy to understand the content from the raw titles. Miss some explanation of the contents or meaningful titles | C10: included fileformats
A11: Any project you would have expected, but didn't find in the results? | B11: those with good technical defintion. No difference between toy projects and real ones | C11: yes, there are far more whistles on thingiverse
A12: Any further comments? | C12: i am glad i find files from thingiverse there. | D12: The names of many of the search results are not very descriptive, but I guess that's not something LOSH can control!
A13: URL of a project detail page (e.g. https://losh.opennext.eu/detail/Q8684) | B13: https://losh.opennext.eu/?page=4&search=pinhole%20camera | C13: https://losh.opennext.eu/detail/Q63315 | D13: https://losh.opennext.eu/detail/Q499768
A14: repo host | B14: - | C14: thingiverse | D14: thingiverse
A15: Without having checked the repository yet – how informative is the metadata in the detail page for you? | B15: 3 | C15: 5 | D15: 3
A16: Does the repository reflect what you expected from the metadata? | B16: Sort of… | C16: Yes! | D16: Yes!
A17: Was it a useful search result? Please rate the relevance of the project. | B17: 3 | C17: 5 | D17: 3
A18: Any metadata fields you have been missing? | B18: The data are OK to replicate if you know the manufacturing process well. No manufacturing process info. | C18: repo thingiverse is not mentioned on the project detail page, the link shows thingiverse
A19: Any further comments? | C19: i need translation of the searchresults https://translate.google.com/?sl=en&tl=de&text=https%3A%2F%2Flosh.opennext.eu%2Fdetail%2FQ63315&op=translate translation is also a problem on thingiverse | D19: Thank you!
A20: What did you type into the search bar? | B20: washing machine | C20: ship | D20: microscope
A21: Please upload your file(s) | B21: LOSHExploreData-1655739857899.csv | C21: LOSHExploreData-1653666929995.csv | D21: LOSHExploreData-1653665906960.csv
A22: First impression: How relevant are the results for you? | B22: 3 | C22: 4 | D22: 4
A23: Please rate the usefulness of the search functionality | B23: 3 | C23: 4 | D23: 4
A24: Any search features you have been missing? (e.g. additional filters) | B24: The problem is that I get too much "thingivers" stuff. This is not really open source project. I look for complete open source washing machine projects not just knob 3D models... | C24: repo host thingiverse does not show up, | D24: I like to be able to customise the number of results per page and see the total number of pages.
A25: Any project you would have expected, but didn't find in the results? | C25: too many results on the page, the csv includes only the first page | D25: I was expecting to see the OpenFlexure Microscope GitLab repositories, but none appeared in my search results.
A26: Any further comments?
A27: URL of a project detail page (e.g. https://losh.opennext.eu/detail/Q8684) | B27: https://losh.opennext.eu/detail/Q631543 | C27: https://losh.opennext.eu/detail/Q60738 | D27: https://losh.opennext.eu/detail/Q7051
A28: repo host | B28: wikifactory | C28: thingiverse | D28: wikifactory
A29: Without having checked the repository yet – how informative is the metadata in the detail page for you? | B29: 3 | C29: 2 | D29: 3
A30: Does the repository reflect what you expected from the metadata? | B30: Cannot tell | C30: Yes! | D30: Yes!
A31: Was it a useful search result? Please rate the relevance of the project. | B31: 3 | C31: 5 | D31: 4
A32: Any metadata fields you have been missing? | B32: button not active anymore | C32: build instructions are missing
A33: Any further comments? | D33: There is a field called "Designed parts" with an item "optics_usb_rms", but I don't know what any of this means.
A34: What did you type into the search bar? | B34: beehive | C34: gun | D34: telescope
A35: Please upload your file(s) | B35: LOSHExploreData-1655740903963.csv | C35: LOSHExploreData-1653667306417.csv | D35: LOSHExploreData-1653666209752.csv
A36: First impression: How relevant are the results for you? | B36: 1 | C36: 4 | D36: 4
A37: Please rate the usefulness of the search functionality | B37: 3 | C37: 4 | D37: 4
A38: Any search features you have been missing? (e.g. additional filters) | B38: Too many lines with the same project. | C38: what material, tools | D38: This time, I was given the option of customising the number of results to show per page, which wasn't available in my previous two searches!
A39: Any project you would have expected, but didn't find in the results?
A40: Any further comments? | D40: The search gave me 7 results called "Dobson" telescope, but it's not clear to me why there are 7 seemingly identical results... Also, the "Download Results" button only gave me a CSV file containing the search results of that page instead of ALL results from all pages. This is confusing, and labour-intensive because I will have to go to each page and click "Download Results" many times!
A41: URL of a project detail page (e.g. https://losh.opennext.eu/detail/Q8684) | B41: https://losh.opennext.eu/detail/Q606416 | C41: https://losh.opennext.eu/detail/Q745774 | D41: https://losh.opennext.eu/detail/Q190467
A42: repo host | B42: wikifactory | C42: thingiverse | D42: thingiverse
A43: Without having checked the repository yet – how informative is the metadata in the detail page for you? | B43: 2 | C43: 3 | D43: 2
A44: Does the repository reflect what you expected from the metadata? | B44: Cannot tell | C44: Not really | D44: Sort of…
A45: Was it a useful search result? Please rate the relevance of the project. | B45: 3 | C45: 3 | D45: 3
A46: Any metadata fields you have been missing? | B46: button not active | C46: rebuilds count, popularity
A47: Any further comments? | C47: to little description: Bang Bang! like the title gun | D47: I like the "Licensor" field, very important and often forgotten.
A48: Please upload your manifest file here: | B48: okh.toml | C48: okh.toml | D48: okh.toml
A49: Please tell us about your experience; how intuitive was the interface for you? | B49: 2 | C49: 4 | D49: 2
A50: How easy was it for you to fill out the fields? | B50: 4 | C50: 4 | D50: 2
A51: Please explain your answers. Did you face any particular challenges? | B51: very heavy. If you are not prepared to this. Most of the information might not be available or may be partial. | C51: units did only come visible after changeing them to an other value before changeing them back to the original value wich i needed | D51: Yeah, a few challenges: 1. There wasn't a way for me to indicate documentation in multiple (human) languages. 2. I'd like see more examples of the "functional description" before I write mine. 3. It's not clear to me as an outsider how to correctly complete the "Outer dimensions" fields and would like to see a worked out example from a real project. 4. I don't know what to do if files in my repository have different licenses, how do I indicate that???
A52: Any fields that should be added to the interface? | D52: Fields for "manifest-language" and "documentation-language" that allows for multilingual situations.
A53: Any fields that felt redundant/useless for you?
A54: Number-Slider Question | C54: 4 | D54: 2
A55: Please explain your answer, in case you have more details to share | C55: manifest is not invalid. maybe i took to less time. but there is no hint why it is invalid maybe Readme repo-relative path to the readme file https://gitlab.opensourceecology.de/verein/projekte/cab/oskar/oskar-braille-keyboard/-/blob/assessment/README.md is marked as: must NOT be valid | D55: (I don't understand this slider....)
A56: To conclude, since you hold the manifest file in your hands now: Do you know how to proceed from here in order to get it onto LOSH? | B56: No idea what to do next | C56: Not 100% sure, I'd like to consult someone from the LOSH team first | D56: Not 100% sure, I'd like to consult someone from the LOSH team first
A57: Anything else you want to share? | C57: i do not have all the requested parts. i have to work on a contribution guide. document what is needed for this to work. is something mandatory or optional? | D57: Thank you!!! I really like the idea of a standardised manifest file.

Sheet: survey results (all) calc
B1: AVERAGE | C1: VARIANCE | D1: COUNT | F1: Researcher | G1: Hardware developer | H1: Researcher | I1: Researcher | J1: Hardware developer | K1: Researcher | L1: Researcher | M1: Hardware developer | N1: Researcher | O1: Heuristic
A2: Please rate the usefulness of the search functionality | B2: of:=AVERAGE([.F2:.X2]) -> 3.21052631578947 | C2: of:=VAR([.F2:.X2]) -> 0.175438596491228 | F2: 3 | G2: 3 | H2: 3 | I2: 3 | J2: 4 | K2: 4 | L2: 3 | M2: 4 | N2: 4 | O2: 3 | P2: 3 | Q2: 3 | R2: 3 | S2: 3 | T2: 3 | U2: 3 | V2: 3 | W2: 3 | X2: 3
A3: Any search features you have been missing? (e.g. additional filters) | F3: not easy to understand the content from the raw titles. Miss some explanation of the contents or meaningful titles | G3: included fileformats | I3: The problem is that I get too much "thingivers" stuff. This is not really open source project. I look for complete open source washing machine projects not just knob 3D models... | J3: repo host thingiverse does not show up, | K3: I like to be able to customise the number of results per page and see the total number of pages. | L3: Too many lines with the same project. | M3: what material, tools | N3: This time, I was given the option of customising the number of results to show per page, which wasn't available in my previous two searches!
A4: Any project you would have expected, but didn't find in the results? | F4: those with good technical defintion. No difference between toy projects and real ones | G4: yes, there are far more whistles on thingiverse | J4: too many results on the page, the csv includes only the first page | K4: I was expecting to see the OpenFlexure Microscope GitLab repositories, but none appeared in my search results.
A5: First impression: How relevant are the results for you? | B5: of:=AVERAGE([.F5:.X5]) -> 3.05263157894737 | C5: of:=VAR([.F5:.X5]) -> 1.83040935672515 | F5: 3 | G5: 4 | H5: 3 | I5: 3 | J5: 4 | K5: 4 | L5: 1 | M5: 4 | N5: 4 | O5: 4 | P5: 3 | Q5: 1 | R5: 5 | S5: 2 | T5: 1 | U5: 4 | V5: 5 | W5: 2 | X5: 1
A6: Any further comments? | G6: i am glad i find files from thingiverse there. | H6: The names of many of the search results are not very descriptive, but I guess that's not something LOSH can control! | N6: The search gave me 7 results called "Dobson" telescope, but it's not clear to me why there are 7 seemingly identical results... Also, the "Download Results" button only gave me a CSV file containing the search results of that page instead of ALL results from all pages. This is confusing, and labour-intensive because I will have to go to each page and click "Download Results" many times! | O6: good cargo bike results found, but the vast majority is unrelated | P6: very interesing results for CNC mills, but only one (however very relevant) matching result | Q6: not a single relevant result found, however this is because result are flooded by unrelated thingiverse designs; relevant project found by going through individual repo hosts by hand | R6: mostly relevant results | S6: mostly irrelevant results | T6: not a single relevant result found | U6: mostly results in the domain of the search term and 1 well-matching result | V6: mostly relevant results and various alternative designs | W6: no relevant result, but some at least qualify for ideation | X6: not a single relevant result found
A7: Was it a useful search result? Please rate the relevance of the project. | B7: of:=AVERAGE([.F7:.X7]) -> 3.57894736842105 | C7: of:=VAR([.F7:.X7]) -> 1.81286549707602 | F7: 3 | G7: 5 | H7: 3 | I7: 3 | J7: 5 | K7: 4 | L7: 3 | M7: 3 | N7: 3 | O7: 5 | P7: 5 | Q7: 5 | R7: 5 | S7: 3 | T7: 1 | U7: 5 | V7: 4 | W7: 2 | X7: 1
A8: repo host | F8: - | G8: Thingiverse | H8: Thingiverse | I8: Wikifactory | J8: Thingiverse | K8: Wikifactory | L8: Wikifactory | M8: thingiverse | N8: thingiverse | O8: OHO | P8: OHO | Q8: OHO | R8: OHO | S8: Thingiverse | T8: Thingiverse | U8: Wikifactory | V8: Thingiverse | W8: Thingiverse | X8: Thingiverse

Sheet: charts
A1: distribution of usefulness for selected result
B2: '+ first impression
A4: Rating | B4: Relevance of selected result | C4: First impression
A5: 5 | B5: of:=COUNTIF(['survey results (all) calc'.$F$7:.$X$7];[.A5]) -> 7 | C5: of:=COUNTIF(['survey results (all) calc'.$F$5:.$X$5];[.A5]) -> 2
A6: 4 | B6: of:=COUNTIF(['survey results (all) calc'.$F$7:.$X$7];[.A6]) -> 2 | C6: of:=COUNTIF(['survey results (all) calc'.$F$5:.$X$5];[.A6]) -> 7
A7: 3 | B7: of:=COUNTIF(['survey results (all) calc'.$F$7:.$X$7];[.A7]) -> 7 | C7: of:=COUNTIF(['survey results (all) calc'.$F$5:.$X$5];[.A7]) -> 4
A8: 2 | B8: of:=COUNTIF(['survey results (all) calc'.$F$7:.$X$7];[.A8]) -> 1 | C8: of:=COUNTIF(['survey results (all) calc'.$F$5:.$X$5];[.A8]) -> 2
A9: 1 | B9: of:=COUNTIF(['survey results (all) calc'.$F$7:.$X$7];[.A9]) -> 2 | C9: of:=COUNTIF(['survey results (all) calc'.$F$5:.$X$5];[.A9]) -> 4
A13: STATEMENTS
A14: cases with 4+ | B14: of:=SUM([.B5:.B6]) -> 9
A15: probability | B15: of:=[.B14]/19 -> 0.473684210526316
A16: cases with 2- | B16: of:=SUM([.B8:.B9]) -> 3
B17: of:=[.B16]/19 -> 0.157894736842105
A41: impression scores
D42: yes | E42: opposite | F42: equal
D43: of:=COUNTIF([.D47:.D65];TRUE()) -> 8 | E43: of:=COUNTIF([.E47:.E65];TRUE()) -> 3 | F43: of:=COUNTIF([.F47:.F65];TRUE()) -> 8
D44: of:=[.D43]/19 -> 0.421052631578947 | E44: of:=[.E43]/19 -> 0.157894736842105 | F44: of:=[.F43]/19 -> 0.421052631578947
B45: a | C45: b | D45: 3/7 | E45: 1/7 | F45: 3/7
A46: repo host | B46: first impression | C46: most relevant result | D46: most relevant higher than expected? | J46: a above average | K46: average of b for a above its average | L46: 2.5
A47: - | B47: 3 | C47: 3 | D47: of:=IF([.C47]>[.B47]) -> false | E47: of:=IF([.C47]<[.B47]) -> false | F47: of:=[.B47]=[.C47] -> true | J47: of:=[.B47]<3 -> false
A48: Thingiverse | B48: 4 | C48: 5 | D48: of:=IF([.C48]>[.B48]) -> true | E48: of:=IF([.C48]<[.B48]) -> false | F48: of:=[.B48]=[.C48] -> false | J48: of:=[.B48]<3 -> false
A49: Thingiverse | B49: 3 | C49: 3 | D49: of:=IF([.C49]>[.B49]) -> false | E49: of:=IF([.C49]<[.B49]) -> false | F49: of:=[.B49]=[.C49] -> true | J49: of:=[.B49]<3 -> false
A50: Wikifactory | B50: 3 | C50: 3 | D50: of:=IF([.C50]>[.B50]) -> false | E50: of:=IF([.C50]<[.B50]) -> false | F50: of:=[.B50]=[.C50] -> true | J50: of:=[.B50]<3 -> false
A51: Thingiverse | B51: 4 | C51: 5 | D51: of:=IF([.C51]>[.B51]) -> true | E51: of:=IF([.C51]<[.B51]) -> false | F51: of:=[.B51]=[.C51] -> false | J51: of:=[.B51]<3 -> false
A52: Wikifactory | B52: 4 | C52: 4 | D52: of:=IF([.C52]>[.B52]) -> false | E52: of:=IF([.C52]<[.B52]) -> false | F52: of:=[.B52]=[.C52] -> true | J52: of:=[.B52]<3 -> false
A53: Wikifactory | B53: 1 | C53: 3 | D53: of:=IF([.C53]>[.B53]) -> true | E53: of:=IF([.C53]<[.B53]) -> false | F53: of:=[.B53]=[.C53] -> false | J53: of:=[.B53]<3 -> true | K53: of:=[.C53] -> 3
A54: thingiverse | B54: 4 | C54: 3 | D54: of:=IF([.C54]>[.B54]) -> false | E54: of:=IF([.C54]<[.B54]) -> true | F54: of:=[.B54]=[.C54] -> false | J54: of:=[.B54]<3 -> false
A55: thingiverse | B55: 4 | C55: 3 | D55: of:=IF([.C55]>[.B55]) -> false | E55: of:=IF([.C55]<[.B55]) -> true | F55: of:=[.B55]=[.C55] -> false | J55: of:=[.B55]<3 -> false
A56: OHO | B56: 4 | C56: 5 | D56: of:=IF([.C56]>[.B56]) -> true | E56: of:=IF([.C56]<[.B56]) -> false | F56: of:=[.B56]=[.C56] -> false | J56: of:=[.B56]<3 -> false
A57: OHO | B57: 3 | C57: 5 | D57: of:=IF([.C57]>[.B57]) -> true | E57: of:=IF([.C57]<[.B57]) -> false | F57: of:=[.B57]=[.C57] -> false | J57: of:=[.B57]<3 -> false
A58: OHO | B58: 1 | C58: 5 | D58: of:=IF([.C58]>[.B58]) -> true | E58: of:=IF([.C58]<[.B58]) -> false | F58: of:=[.B58]=[.C58] -> false | J58: of:=[.B58]<3 -> true | K58: of:=[.C58] -> 5
A59: OHO | B59: 5 | C59: 5 | D59: of:=IF([.C59]>[.B59]) -> false | E59: of:=IF([.C59]<[.B59]) -> false | F59: of:=[.B59]=[.C59] -> true | J59: of:=[.B59]<3 -> false
A60: Thingiverse | B60: 2 | C60: 3 | D60: of:=IF([.C60]>[.B60]) -> true | E60: of:=IF([.C60]<[.B60]) -> false | F60: of:=[.B60]=[.C60] -> false | J60: of:=[.B60]<3 -> true | K60: of:=[.C60] -> 3
A61: Thingiverse | B61: 1 | C61: 1 | D61: of:=IF([.C61]>[.B61]) -> false | E61: of:=IF([.C61]<[.B61]) -> false | F61: of:=[.B61]=[.C61] -> true | J61: of:=[.B61]<3 -> true | K61: of:=[.C61] -> 1
A62: Wikifactory | B62: 4 | C62: 5 | D62: of:=IF([.C62]>[.B62]) -> true | E62: of:=IF([.C62]<[.B62]) -> false | F62: of:=[.B62]=[.C62] -> false | J62: of:=[.B62]<3 -> false
A63: Thingiverse | B63: 5 | C63: 4 | D63: of:=IF([.C63]>[.B63]) -> false | E63: of:=IF([.C63]<[.B63]) -> true | F63: of:=[.B63]=[.C63] -> false | J63: of:=[.B63]<3 -> false
A64: Thingiverse | B64: 2 | C64: 2 | D64: of:=IF([.C64]>[.B64]) -> false | E64: of:=IF([.C64]<[.B64]) -> false | F64: of:=[.B64]=[.C64] -> true | J64: of:=[.B64]<3 -> true | K64: of:=[.C64] -> 2
A65: Thingiverse | B65: 1 | C65: 1 | D65: of:=IF([.C65]>[.B65]) -> false | E65: of:=IF([.C65]<[.B65]) -> false | F65: of:=[.B65]=[.C65] -> true | J65: of:=[.B65]<3 -> true | K65: of:=[.C65] -> 1
A70: metadata quality
B72: b
A73: repo host | B73: most relevant result
A74: - | B74: 3
A75: Thingiverse | B75: 5
A76: Thingiverse | B76: 3
A77: Wikifactory | B77: 3
A78: Thingiverse | B78: 5
A79: Wikifactory | B79: 4
A80: Wikifactory | B80: 3
A81: thingiverse | B81: 3
A82: thingiverse | B82: 3
A83: OHO | B83: 5
A84: OHO | B84: 5
A85: OHO | B85: 5
A86: OHO | B86: 5
A87: Thingiverse | B87: 3
A88: Thingiverse | B88: 1
A89: Wikifactory | B89: 5
A90: Thingiverse | B90: 4
A91: Thingiverse | B91: 2
A92: Thingiverse | B92: 1

Sheet: search terms
A1: researcher | B1: hardware developer | C1: top 10 OHO terms
A2: pinhole camera | B2: whistle | C2: cargo bike
A3: washing machine | B3: ship | C3: corn mill
A4: beehive | B4: gun | C4: hot water collector
A5: pcr | C5: water turbine
A6: microscope | C6: brick machine
A7: telescope | C7: power hammer
C8: lathe
C9: water pump
C10: lattice tower
C11: concrete mixer